Fuente,Título,Contenido,Sección,Url,Fecha
Expansión,"El tema energético con Estados Unidos ya se resolvió, asegura Raquel Buenrostro",La titular de Economía explicó que todos los temas por los que había una diferencia en materia energética -electricidad y de hidrocarburos- entre México y EU quedaron resueltos.,Economía,https://expansion.mx/economia/2024/02/27/mexico-eu-resolvieron-conflicto-energetico-buenrostro,28/02/2024
Expansión,"Banco del Bienestar supera meta y llega a 3,149 sucursales","La dependencia informó que 2,750 sucursales fueron construidas exclusivamente por la Secretaría de la Defensa (Sedena).",Economía,https://expansion.mx/economia/2024/02/27/cuantas-sucursales-tiene-banco-bienestar,27/02/2024
Expansión,OpenAI responde a la demanda de Musk: “Quería el control de la empresa”,Los fundadores de la empresa señalaron que el multimillonario buscaba que OpenAI se fusionara con Tesla y a partir de ahí convertirse en su director ejecutivo.,Ciencia y tecnología,https://expansion.mx/tecnologia/2024/03/06/openai-responde-demanda-elon-musk,06/03/2024
Expansión,Tinder Latam y Sensei Media lanzan pódcast en México: ¡Haz Match!,La actriz y presentadora Ana Sáenz se une al proyecto como la conductora oficial de ¡Haz Match! para charlar con celebridades y parejas sobre sus historias en Tinder.,Ciencia y tecnología,https://expansion.mx/tecnologia/2024/03/06/tinder-latam-y-sensei-media-lanzan-podcast-en-mexico-haz-match,06/03/2024
Expansión,Airbnb señala que las estancias de Semana Santa descubrirán nuevos destinos,"Los viajeros nacionales están buscando destinos menos turísticos, donde la idea es explorar nuevos pueblitos y ciudades.",Ciencia y tecnología,https://expansion.mx/tecnologia/2024/03/06/destinos-favoritos-mexico-segun-airbnb,06/03/2024
Expansión,Fujifilm quiere revivir la pasión de la fotografía más allá de un algoritmo,La empresa japonesa abrió un showroom en Ciudad de México con el objetivo de mostrar las diferentes categorías de sus productos e impulsar la creación artística.,Ciencia y tecnología,https://expansion.mx/tecnologia/2024/03/06/fujifilm-mexico-abre-showroom-analogico-cdmx,06/03/2024
Expansión,Amazon México quiere llevar su corazón editorial al e-commerce,"La empresa de tecnología tiene un nuevo gerente general en el país, Pedro Huerta, quien tiene experiencia en la industria de los libros, pero también en dispositivos inteligentes.",Ciencia y tecnología,https://expansion.mx/tecnologia/2024/03/05/amazon-mexico-ventas-de-libros-terreno-digital,05/03/2024
Expansión,¿Cómo restablecer tu cuenta de Instagram sin correo ni número de teléfono?,Así puedes restablecer tu cuenta de Instagram si olvidaste tu contraseña. Te enseñamos cómo recuperarlo sin correo ni número de celular.,Ciencia y tecnología,https://expansion.mx/tecnologia/2024/03/05/como-restablecer-cuenta-instagram,05/03/2024
Expansión,Verificación en dos pasos para Facebook e Instagram: Cómo activarla,Para que no te roben tus cuentas existe la opción de activar esta segunda capa de seguridad. Hazlo paso a paso.,Ciencia y tecnología,https://expansion.mx/tecnologia/2024/03/05/verificacion-dos-pasos-facebook-instagram-como-activar,05/03/2024
Expansión,Así puedes restablecer tu contraseña de Facebook,Facebook señala que existen opciones de recuperación de tu contraseña para que evites la pérdida de tu información.,Ciencia y tecnología,https://expansion.mx/tecnologia/2024/03/05/como-recuperar-contrasena-de-facebook,05/03/2024
Expansión,Se cayó Facebook a nivel mundial; reportan que sesión caducó e Instagram falla,"Los usuarios reportan que sus sesiones en las aplicaciones se cerraron de manera repentina, mientras que la carga en Instagram es lenta.",Ciencia y tecnología,https://expansion.mx/tecnologia/2024/03/05/se-cayo-facebook-instagram-que-paso,05/03/2024
Expansión,Ericsson quiere construir la red privada de Tesla en Nuevo León,La compañía sueca ha sido la encargada de crear la red privada de otras empresas con éxito.,Ciencia y tecnología,https://expansion.mx/tecnologia/2024/03/05/ericsson-red-privada-planta-de-tesla-en-nuevo-leon-mexico,05/03/2024
Expansión,"X activó llamadas, pero accede a tus datos. Así puedes bloquear esta función","La nueva funcionalidad de la plataforma filtra la dirección IP de los usuarios, lo que pone en riesgo su seguridad en línea.",Ciencia y tecnología,https://expansion.mx/tecnologia/2024/03/05/ip-expuesta-llamadas-x-como-evitarlo,05/03/2024
Expansión,WhatsApp vence a NSO Group y tendrá acceso al código de Pegasus,"Una jueza de Estados Unidos ordenó a la empresa israelí dar acceso a WhatsApp a su software, luego de haber espiado a 1,400 de sus usuarios durante dos semanas.",Ciencia y tecnología,https://expansion.mx/tecnologia/2024/03/04/whatsapp-gana-nso-group-acceso-a-pegasus,04/03/2024
Expansión,"La UE golpea con 1,950 mdd a Apple por abusar del mercado de música en streaming","De acuerdo con la Comisión Europea, Apple prohíbe a desarrolladores informar sobre servicios alternativos y más baratos fuera de la App Store.",Ciencia y tecnología,https://expansion.mx/tecnologia/2024/03/04/ue-multa-apple-abusar-mercado-musica-streaming,04/03/2024
Expansión,TREBEL Music triunfa en los premios Google Play Best Of,"Best App, Daily Essentials y User’s Choice, son las tres categorías en las que se reconoció a esta aplicación de música",Ciencia y tecnología,https://expansion.mx/tendencias/2024/03/03/trebel-music-triunfa-en-google-play-best-of,04/03/2024
Expansión,Microsoft vende Toys for Bob para volver a ser un estudio independiente,El estudio afirmó que esta es una oportunidad para regresar a las raíces de ser una empresa “pequeña y ágil”.,Ciencia y tecnología,https://expansion.mx/tecnologia/2024/02/29/microsoft-vende-toys-for-bob-para-volver-a-ser-un-estudio-independiente,29/02/2024
Expansión,Esta lavadora con IA cuestionará tu forma de lavar,La tecnología de la Bespoke AI Laundry está enfocada en hacer más eficiente el uso de detergentes y agua.,Ciencia y tecnología,https://expansion.mx/tecnologia/2024/02/29/esta-lavadora-ia-samsung-te-dira-si-lavas-bien-tu-ropa,29/02/2024
Expansión,PS Plus: estos son los juegos gratis que llegan en marzo de 2024,PlayStation dio a conocer los juegos gratuitos que llegarán a PS Plus en marzo de 2024. Te decimos cuáles son y a partir de cuándo estarán disponibles.,Ciencia y tecnología,https://expansion.mx/tecnologia/2024/02/29/juegos-gratis-ps-plus-marzo-2024,29/02/2024
Expansión,"Si no se actualizó Max, te dejamos el paso a paso","En caso de que no hayas notado el cambio o necesites hacer la migración de manera manual, te explicamos cómo hacerlo.",Ciencia y tecnología,https://expansion.mx/tecnologia/2024/02/28/como-cambiar-hbo-max-a-max,28/02/2024
Expansión,"Adiós, Apple Car; hola a la IA generativa","La empresa de Cupertino canceló su Proyecto Titán, mismo que se enfocaba en el desarrollo de un vehículo eléctrico.",Ciencia y tecnología,https://expansion.mx/tecnologia/2024/02/28/apple-cancela-proyecto-auto-electrico,28/02/2024
Expansión,Ya podrás clonar tu personalidad con IA Generativa,"Rili.ai es una aplicación que permite que los usuarios tengan una réplica de ellos mismos, ya sea a través de un clon laboral o uno para asuntos personales.",Ciencia y tecnología,https://expansion.mx/tecnologia/2024/02/28/clones-con-inteligencia-artificial-ya-son-una-realidad,28/02/2024
Expansión,Huawei quiere que los estadios del Mundial 2026 tengan red 5.5G,La compañía aseguró que tiene la capacidad de desplegar tecnología para generar conexiones más rápidas en recintos concurridos.,Ciencia y tecnología,https://expansion.mx/tecnologia/2024/02/28/huawei-quiere-que-los-estadios-del-mundial-2026-tengan-red-5-5g,28/02/2024
Expansión,Hackean a la Sedena y el Portal del empleo; venden datos de los usuarios,Los datos de 12 millones de mexicanos se vieron afectados por esta vulneración al portal empleo.gob.mx.,Ciencia y tecnología,https://expansion.mx/tecnologia/2024/02/27/hackean-sedena-portal-del-empleo,27/02/2024
Expansión,¿Es malo dejar mi laptop conectada todo el tiempo a la luz?,"Las laptos son herramientas de mucho uso. Sin embargo, muchas personas tienden a dejarlas conectadas todo el tiempo. Te decimos cómo afecta esto a tu ordenador.",Ciencia y tecnología,https://expansion.mx/tecnologia/2024/02/27/es-malo-dejar-mi-laptop-conectada-todo-el-tiempo,27/02/2024
Expansión,"IA híbrida, así es cómo se desbloqueará el máximo potencial de la tecnología",Conoce por qué este nuevo estándar es lo que los especialistas están buscando desarrollar y su impacto en el mundo de la tecnología.,Ciencia y tecnología,https://expansion.mx/tecnologia/2024/02/27/que-es-ia-hibrida-como-superara-potencial-de-chatgpt,27/02/2024
Expansión,Sony recorta 900 empleos de su división de PlayStation,La tecnológica japonesa se une a la ola de despidos que está afectando a la industria de los videojuegos.,Ciencia y tecnología,https://expansion.mx/tecnologia/2024/02/27/sony-despido-masivo-cierra-london-studio,27/02/2024
Expansión,A los mexicanos les gustan los smartphones chinos,"George Zhao, CEO de Honor devices, explicó la importancia de México para su estrategia de negocios a través de toda Latinoamérica.",Ciencia y tecnología,https://expansion.mx/tecnologia/2024/02/27/a-los-mexicanos-les-gustan-los-telefonos-chinos,27/02/2024
Expansión,Warner Bros. Discovery busca aumentar cuota de mercado en México con Max,La plataforma de streaming hasta ahora se coloca detrás de Netflix en la preferencia de consumo de contenidos por parte de los mexicanos.,Ciencia y tecnología,https://expansion.mx/tecnologia/2024/02/27/hbo-max-se-convierte-en-max-precio-mexico,27/02/2024
Expansión,Google quiere que mejores tus fotos con IA en solo segundos,"La compañía mostró  en el Mobile World Congress aplicativos para mejorar fotos, lectura de mensajes en auto y descripciones de imágenes con base en IA.",Ciencia y tecnología,https://expansion.mx/tecnologia/2024/02/26/google-android-ia-mwc-2024,27/02/2024
Expansión,"Xiaomi presenta su serie 14, el SU7 Max y su cyberdog en el MWC","La empresa de origen chino presentó varias novedades en la feria de Barcelona, entre ellas la nueva serie Xiaomi 14, con lentes Leica.",Ciencia y tecnología,https://expansion.mx/tecnologia/2024/02/26/xiaomi-14-ultra-mwc-2024,26/02/2024
Expansión,Así puedes migrar tus cuentas de streaming a una nueva cuenta,"Si decidiste independizarte de la cuenta que compartías con tus papás o amigos, podrás hacerlo con los siguientes pasos.",Ciencia y tecnología,https://expansion.mx/tecnologia/2024/02/26/migrar-perfil-netflix-cuenta-nueva,26/02/2024
Expansión,Huawei desarrolla su IA Pangu para dar batalla a Chat GPT,"El gigante tecnológico chino desarrolló su IA que busca enfocar su servicio en industrias de movilidad, minería, salud y clima, en contraste con Chat GPT que es para cualquier usuario.",Ciencia y tecnología,https://expansion.mx/tecnologia/2024/02/26/huawei-desarrolla-su-ia-pangu-para-dar-batalla-a-chat-gpt,26/02/2024
Expansión,"Honor Magic6 Pro, así es el teléfono que podrás controlar con los ojos","Con la función de Eye Control de este teléfono también será posible encender otros dispositivos, como automóviles eléctricos compatibles.",Ciencia y tecnología,https://expansion.mx/tecnologia/2024/02/25/honor-magic6-pro-lanzamiento-caracteristicas,25/02/2024
Expansión,"Japón ayudará a TSMC con 4,900 mdd para producción de chips para IA","La empresa, que también se está expandiendo en EU y Alemania, tiene previsto iniciar la producción en masa en el país asiático antes de finales de año.",Ciencia y tecnología,https://expansion.mx/tecnologia/2024/02/24/japon-ayudara-a-tsmc-con-4-900-mdd-para-produccion-de-chips-para-ia,24/02/2024
Expansión,"Mario vs Donkey Kong, el regreso de un clásico que los más jóvenes disfrutarán",Nintendo lanzó esta nueva versión del juego publicado hace 20 años en Game Boy Advance. ¿Esta edición para Nintendo Switch logra desmarcarse y crear su propio camino?,Ciencia y tecnología,https://expansion.mx/tecnologia/2024/02/24/mario-vs-donkey-kong-el-regreso-de-un-clasico-que-los-mas-jovenes-disfrutaran,24/02/2024
Expansión,Ya puedes recargar tu tarjeta de movilidad con la App CDMX,"Si eres usuario del transporte público en la metrópoli capitalina, ya podrás recargar la tarjeta de movilidad desde la aplicación donde haces los trámites con el gobierno.",Ciencia y tecnología,https://expansion.mx/tecnologia/2024/02/23/como-recargar-tarjeta-movilidad-integrada-app-cdmx,23/02/2024
La Jornada,Oro rompe barrera de 2 mil dólares,,Economía,https://www.jornada.com.mx/2024/03/07/economia/021n3eco?partner=rss,07/03/2024
La Jornada,Confianza del consumidor logra su quinto mejor registro en 2 décadas: Inegi,"En febrero, preámbulo de las campañas electorales, el Indicador de Confianza del Consumidor (ICC) se ubicó en 47.01 puntos, su quinto mejor registro desde que inició la serie hace más de dos décadas. El dato representa una ligera baja respecto a enero, cuando la medición dio como resultado 47.05 puntos; en el comparativo anual tuvo un avance de 2.4 puntos, reportó el Instituto Nacional de Estadística y Geografía (Inegi).",Economía,https://www.jornada.com.mx/2024/03/07/economia/021n1eco?partner=rss,07/03/2024
La Jornada,Avanza producción y exportación de autos,"Los cuellos de botella que registró la industria automotriz mexicana debido a la interrupción de cadenas de suministro a nivel mundial se han ido desfogando. En febrero, su producción aumentó 7.76 por ciento a tasa anual y la venta de unidades al extranjero repuntó 22.62 por ciento, consignó el Instituto Nacional de Estadística y Geografía (Inegi).",Economía,https://www.jornada.com.mx/2024/03/07/economia/019n2eco?partner=rss,07/03/2024
La Jornada,Enrique Galván Ochoa: Dinero,"El crimen de Ayotzinapa fue cometido hace 10 años, en el sexenio de Enrique Peña Nieto; las consecuencias –la puerta de Palacio Nacional derribada por gente con el rostro cubierto– alcanzan al gobierno que sustituyó al priísta. Ayer fue día de regocijo para los malquerientes del presidente López Obrador. El video de la puerta sugiere un final violento del sexenio, lo cual no corresponde a la realidad. Mayor regocijo les hubiera causado que los guardias los repelieran con saldo de muertos y heridos. Exigían ser recibidos por el Presidente. La irrupción lo sorprendió en plena mañanera. Le preguntaron los reporteros si los atendería. Comentó: “no, yo estoy analizando y conduciendo todo porque lo que me importa es encontrar a los 43 jóvenes. La actitud, no de los padres, sino de los asesores y de las organizaciones que supuestamente defienden los derechos humanos, en el mejor de los casos, es una actitud política de confrontación en contra nuestra”. El candidato López Obrador hizo en campaña el compromiso de resolver el caso. Faltan seis meses y días para que concluya su gobierno. Se ha reunido en repetidas ocasiones con los padres para ponerlos al tanto de los avances. Para la mayoría de la gente, Ayotzinapa es un expediente en el que están involucrados mandos militares y autoridades civiles del peñanietismo; hay detenidos. Las investigaciones pareciera que han enredado más el caso y alargado el dolor de los familiares de las víctimas. Queda la duda si los acontecimientos de ayer son parte del go negative sugerido por Jorge Castañeda. En cualquier caso, López Obrador debería dar a conocer los resultados de la averiguación que está conduciendo, aunque no satisfagan a todos.",Economía,https://www.jornada.com.mx/2024/03/07/opinion/006o1eco?partner=rss,07/03/2024
La Jornada,El peso hila cinco jornadas de ganancia frente al dólar,"Pese al desfase de políticas monetarias entre México y Estados Unidos, que hará disminuir a corto plazo el diferencial de tasas de interés entre ambas economías, México sigue siendo atractivo para los inversionistas internacionales, de ahí la fortaleza de la moneda nacional, que está en su mejor nivel desde inicios del año.",Economía,https://www.jornada.com.mx/2024/03/07/economia/021n2eco?partner=rss,07/03/2024
La Jornada,Contribuyen migrantes al aumento de inversión y exportaciones: OIM,"Los migrantes son catalizadores de las economías, pues sus acciones contribuyen al aumento de las exportaciones, inversión extranjera directa (IED) y productividad, aseguró Violetta Kuzmova, titular del área de Desarrollo Sostenible y Migración de la Organización Internacional para las Migraciones (OIM).",Economía,https://www.jornada.com.mx/2024/03/07/economia/020n1eco?partner=rss,07/03/2024
La Jornada,Disciplina y menos riesgos entre mujeres inversionistas,"Pese a que tienen menos confianza a la hora de elegir sus inversiones, las mujeres suelen superar la rentabilidad de las carteras de capital de los hombres, ya que son disciplinadas, tienen menos probabilidades de cambiar su perfil de riesgo en medio de la volatilidad, se documentan y arriesgan de acuerdo con sus objetivos, evidenció UBS Women and Investing.",Economía,https://www.jornada.com.mx/2024/03/07/economia/017n2eco?partner=rss,07/03/2024
La Jornada,John Saxe-Fernández: Guerra o paz: advertencia en lengua franca,"El presidente francés Emmanuel Macrón, diciendo y desdiciéndose, propuso en la conferencia de apoyo a Ucrania (París, 26 /1/24) frente a 27 líderes y ministros de la UE y la OTAN, enviar tropas terrestres al campo de batalla ucranio, a sabiendas de que esto generaría intensificación bélica, y un rechazo generalizado para luego recular manteniendo su hostilidad rusofóbica. Enviar tropas a la zona de conflicto es una provocación de orden mayor contra Rusia.",Economía,https://www.jornada.com.mx/2024/03/07/economia/018a1eco?partner=rss,07/03/2024
La Jornada,"Sin fundamento, inquietud de EU por vehículos chinos","En el primer bimestre del año, dos de cada 10 autos vendidos en México fueron importados de China, señaló en conferencia Cristina Vázquez, coordinadora de Estudios Económicos de la Asociación Mexicana de Distribuidores de Automotores (AMDA).",Economía,https://www.jornada.com.mx/2024/03/07/economia/019n3eco?partner=rss,07/03/2024
La Jornada,"Integración femenina en el mercado laboral mexicano, de las más bajas en Latinoamérica","La participación de las mujeres en el mercado laboral mexicano es de las más bajas en América Latina, un hecho influenciado por factores sociales y culturales que limitan su incorporación a las actividades económicas aunado a la falta de políticas públicas, dio a conocer Citibanamex.",Economía,https://www.jornada.com.mx/2024/03/07/economia/017n1eco?partner=rss,07/03/2024
La Jornada,Con la construcción de 2 nuevas terminales recuperará el AICM capacidad operativa,"El gobierno mexicano recuperará la capacidad del Aeropuerto Internacional de la Ciudad de México (AICM) de manera gradual y se han realizado estudios que implican la construcción de dos nuevas terminales en los próximos 10 años para atender la demanda actual y futura de la instalación, en el contexto de que “las terminales 1 y 2 se acercan al final de su vida útil”, informó la Secretaría de Infraestructura, Comunicaciones y Transportes (SICT).",Economía,https://www.jornada.com.mx/2024/03/07/economia/019n1eco?partner=rss,07/03/2024
La Jornada,Ingresos por ventas de café cayeron 28% en un año,"El valor de las exportaciones de café de México cayó 28 por ciento en 2023 en comparación al año previo, revelan datos oficiales. Lo anterior a pesar de un contexto de mayores cotizaciones internacionales y afectaciones a las cosechas por fenómenos climáticos adversos.",Economía,https://www.jornada.com.mx/2024/03/07/economia/019n4eco?partner=rss,07/03/2024
La Jornada,Persiste brecha de género en TIC,,Economía,https://www.jornada.com.mx/2024/03/07/economia/017n4eco?partner=rss,07/03/2024
La Jornada,Impuesto de la desigualdad,"Berlín. Aunque a veces los productos sólo se diferencian en el diseño y el tamaño del envase, uno pensado para un público femenino y el otro para uno masculino, son las alemanas quienes pagan más.",Economía,https://www.jornada.com.mx/2024/03/07/economia/017n3eco?partner=rss,07/03/2024
La Jornada,"Bonos de ultralargo plazo y recorte de impuestos, plan de desarrollo chino","Pekín. El objetivo de crecimiento del PIB de China de alrededor de 5 por ciento para 2024 es alcanzable mediante “arduo trabajo”, afirmó este miércoles Zheng Shanjie, director de la Comisión Nacional de Desarrollo y Reforma, al explicar las principales acciones gubernamentales para restablecer la economía en este año.",Economía,https://www.jornada.com.mx/2024/03/07/economia/018n1eco?partner=rss,07/03/2024
La Jornada,Expertos reducen previsiones de crecimiento para Alemania,"Berlín. Dos institutos de investigación alemanes recortaron ayer sus previsiones de crecimiento para 2024, en el último golpe a la mayor economía de la zona euro.",Economía,https://www.jornada.com.mx/2024/03/07/economia/020n2eco?partner=rss,07/03/2024
La Jornada,Carlos Fernández-Vega: México SA,"Dado que,  de forma por demás aferrada, no pocos “expertos” y “opinadores” cuestionan la reorganización, reinvención, reflorecimiento, reflotación o como quiera llamársele, surge una duda: si el saqueo a instituciones de salud pública como el Issste y el IMSS fue más que descarado a lo largo de 36 años, ¿por qué los histéricos gritones de hoy permanecieron en sepulcral silencio cuando ello sucedía? Parece que sólo habría una explicación: fueron cómplices de quienes llevaron a cabo ese latrocinio, como en tantos otros casos.",Economía,https://www.jornada.com.mx/2024/03/07/opinion/020o1eco?partner=rss,07/03/2024
La Jornada,“Los eclipses son herramientas que da la naturaleza para conocerla mejor”,"Los eclipses, más allá de atraer la atención de niños y adultos, de dar lugar a mitos e inspirar a literatos, “son herramientas que nos proporciona la naturaleza para conocerla mejor”, afirmó Luis Felipe Rodríguez Jorge. Mediante su observación se ha ampliado el conocimiento sobre el movimiento de los cuerpos en el sistema solar, se descubrió el helio y se comprobó la teoría de la relatividad, así como que la Tierra rota cada vez más lentamente.",Ciencia y tecnología,https://www.jornada.com.mx/2024/03/07/ciencias/a06n1cie?partner=rss,07/03/2024
La Jornada,Diputados rinden tributo al creador  de Macondo,"En el aniversario 97 del nacimiento del escritor Gabriel García Márquez, la Cámara de Diputados recordó al premio Nobel de Literatura 1982 como “uno de los maestros de la literatura universal” y ponderó “su genialidad y su contribución al patrimonio cultural de la humanidad”.",Cultura,https://www.jornada.com.mx/2024/03/07/cultura/a04n2cul?partner=rss,07/03/2024
La Jornada,Llega a Rusia “una buena historia”,"Moscú. La novela póstuma de Gabriel García Márquez, En agosto nos vemos, salió ayer a la luz en Rusia, confirmó el grupo editorial AST.",Cultura,https://www.jornada.com.mx/2024/03/07/cultura/a03n3cul?partner=rss,07/03/2024
La Jornada,"Artistas cubanos colaboran a fomentar el muralismo en San Salvador, Hidalgo","San Salvador, Hgo., Como parte de las actividades para impulsar el interés de los vecinos de las comunidades indígenas en la elaboración de murales y en las artes plásticas, fue develado el pasado 1º de marzo el mural Hermanamiento de nuestras raíces y corazones de América, en la localidad otomí de El Rodrigo, del municipio de San Salvador, Hidalgo.",Cultura,https://www.jornada.com.mx/2024/03/07/cultura/a05n2cul?partner=rss,07/03/2024
La Jornada,Explora Tomás Pérez Vejo la “invención” de México,"El historiador Tomás Pérez Vejo, en su libro La nación doliente: Imágenes profanas para una historia sagrada (Instituto Nacional de Antropología e Historia, 2024), relata cómo a partir del siglo XIX se deja de contar en la pintura de México la historia del nacimiento, muerte y resurrección de Cristo para narrar la historia del nacimiento, muerte y resurrección de la nación mexicana.",Cultura,https://www.jornada.com.mx/2024/03/07/cultura/a05n1cul?partner=rss,07/03/2024
La Jornada,José Cueli: El Goya de Palillo,"Cristina de Hoyos, flamenca de la flamenquería catalana, magia de magias, se vistió de futbolista del equipo Barcelona, por una parte, y, por la otra, de Puma universitario. Todo esto en el marco del Camp Nou, en el que no cabía ni una mosca más, vibrando en el instante de aprisionar en unos pases el ritmo de la furia española futbolera tornada rumba flamenca, vibrante y que escondía su amor por el pintor aragonés. ¡Goya, goya!",Cultura,https://www.jornada.com.mx/2024/03/07/cultura/a04a1cul?partner=rss,07/03/2024
La Jornada,Víctor Benítez define la máscara como una metáfora de la identidad,"Más que un artefacto para ocultar el rostro o representar a alguien o algo más, el fotógrafo Víctor Benítez entiende a la máscara como un concepto o metáfora de la identidad, tema al que ha encaminado gran parte de su interés y propuesta creativos.",Cultura,https://www.jornada.com.mx/2024/03/07/cultura/a04n1cul?partner=rss,07/03/2024
